1,Pokey,1,orange,short,0,15,Clumber Spaniel,11,Breeder,1,Eius tempora porro etincidunt.
2,Roxy,1,white,long,0,8,Mutt,5,Shelter,0,Amet modi voluptatem tempora est.
3,Phantom,1,brown,short,0,8,Mutt,14,Shelter,0,Magnam labore eius adipisci.
4,Nike,1,black,medium,1,7,Unknown,7,Breeder,1,Numquam quaerat dolore sed voluptatem modi.
5,Bandit,1,black,medium,0,5,English Springer Spaniel,16,Breeder,0,Tempora adipisci ut quaerat est sit quaerat.
6,Cisco,1,spotted,medium,0,15,Mutt,12,Rescue,0,Porro voluptatem aliquam porro sed.
7,Minnie,1,spotted,long,0,0,Tenterfield Terrier,22,Shelter,0,Amet aliquam consectetur est.
8,Winnie,1,orange,long,1,7,Unknown,15,Breeder,0,Sed consectetur porro quiquia.
9,Stich,1,black,long,0,5,Nova Scotia Duck Tolling Retriever,6,Breeder,0,Consectetur voluptatem voluptatem modi ut.
10,Shorty,1,orange,medium,0,14,Irish Wolfhound,16,Breeder,0,Non voluptatem quiquia est etincidunt tempora.
11,Gus,2,black,long,0,5,Mutt,22,Rescue,0,Quiquia numquam etincidunt tempora.
12,Noodles,2,white,medium,1,10,Manx,5,Breeder,0,Voluptatem tempora voluptatem dolore.
13,Mister,2,spotted,medium,1,6,Turkish Angora,14,Breeder,0,Non adipisci est magnam quaerat eius.
14,Emily,2,black,long,0,11,Mutt,17,Rescue,0,Adipisci tempora amet sed eius eius consectetur eius.
15,Kayla,2,orange,medium,1,8,Unknown,7,Shelter,0,Ipsum neque sed dolor dolore consectetur dolorem.
16,Loki,2,spotted,short,0,19,Mutt,22,Breeder,1,Quaerat numquam neque modi.
17,Woody,2,white,medium,1,2,British Shorthair,16,Rescue,0,Modi quiquia dolore modi ipsum dolorem numquam.
18,Ozzy,2,orange,short,0,2,English Springer Spaniel,23,Shelter,0,Voluptatem aliquam sit voluptatem voluptatem consectetur.
19,Squirt,2,black,short,0,1,Cairn Terrier,25,Rescue,0,Ipsum dolor eius tempora etincidunt dolor adipisci consectetur.
20,Bits,2,spotted,short,0,17,Chinese Crested,18,Breeder,0,Sed neque modi amet.
21,Monty,3,spotted,medium,1,12,Burmese,5,Breeder,0,Modi voluptatem dolore aliquam dolorem.
22,Kasey,3,orange,short,1,14,Sphynx,11,Breeder,1,Modi est non quisquam.
23,Tommy-boy,3,spotted,long,0,2,Borzoi,16,Rescue,0,Velit est quiquia modi.
24,Ashley,3,white,short,0,14,Golden Retriever,14,Shelter,0,Dolorem dolorem quiquia ipsum dolorem ipsum magnam aliquam.
25,Gromit,3,brown,medium,0,1,Mutt,14,Shelter,0,Velit eius sit ut adipisci.
26,Julius,3,brown,long,1,16,Unknown,18,Shelter,0,Modi neque dolor porro adipisci amet dolorem numquam.
27,Lady,3,black,medium,0,1,Mutt,17,Breeder,1,Quaerat sit ut quisquam dolore.
28,Mattie,3,black,short,0,6,Mutt,10,Rescue,0,Adipisci velit consectetur adipisci.
29,Admiral,3,orange,long,0,15,Portuguese Water Dog,9,Rescue,0,Etincidunt ut dolore ipsum quiquia magnam adipisci.
30,Dewey,3,brown,short,1,2,Turkish Angora,13,Shelter,0,Quiquia neque quisquam etincidunt modi consectetur.
31,Jewels,4,white,long,0,6,Mutt,5,Shelter,0,Consectetur porro sit dolorem adipisci dolor quiquia.
32,Connor,4,black,short,1,15,Unknown,8,Breeder,0,Ipsum modi quaerat eius magnam etincidunt adipisci non.
33,Pedro,4,spotted,short,1,12,Siamese,16,Breeder,0,Ut voluptatem quaerat quaerat ut quiquia quisquam.
34,Poochie,4,white,medium,0,12,Mutt,8,Breeder,0,Consectetur modi neque ut ipsum.
35,Patty,4,brown,medium,0,8,Manchester Terrier,9,Breeder,0,Quaerat tempora dolore quaerat sed tempora.
36,Hope,4,white,short,1,7,Manx,9,Shelter,0,Neque non numquam tempora labore numquam non.
37,Pandora,4,white,medium,1,6,Unknown,9,Breeder,1,Sed sit est amet voluptatem eius.
38,Pirate,4,brown,long,0,2,Mutt,18,Shelter,0,Dolor ipsum sed eius amet consectetur.
39,Arrow,4,spotted,short,1,19,Scottish Fold,11,Shelter,0,Aliquam dolore adipisci etincidunt.
40,Griffen,4,orange,medium,0,19,Swedish Vallhund,22,Breeder,0,Labore labore eius ut labore.
41,Toby,5,black,long,0,13,Australian Kelpie,7,Shelter,0,Adipisci neque quisquam aliquam non sit numquam magnam.
42,Samantha,5,spotted,medium,0,20,Mutt,17,Rescue,0,Quaerat labore amet dolore dolor modi.
43,Kobe,5,black,short,1,4,Unknown,14,Rescue,0,Sit velit ut neque aliquam.
44,Casper,5,spotted,long,0,10,Bichon Frise,6,Rescue,0,Tempora voluptatem dolore quiquia.
45,Haley,5,white,medium,1,10,Turkish Angora,13,Rescue,0,Quaerat modi aliquam magnam quisquam sit modi voluptatem.
46,Paris,5,white,short,0,17,Mutt,8,Breeder,0,Quaerat numquam numquam magnam.
47,Bits,5,spotted,short,1,20,Unknown,5,Shelter,0,Velit dolorem adipisci voluptatem quaerat neque.
48,Boomer,5,orange,short,1,20,Turkish Angora,18,Breeder,0,Labore dolore tempora porro adipisci.
49,Bullet,5,spotted,short,1,16,Maine Coon,6,Breeder,0,Porro dolor voluptatem amet.
50,Garfield,5,orange,medium,1,20,Turkish Angora,5,Shelter,0,Etincidunt quisquam quaerat quiquia.
51,Tramp,6,spotted,long,1,14,Unknown,6,Shelter,0,Quisquam ut quisquam modi.
52,T-bird,6,brown,medium,1,10,Unknown,13,Breeder,0,Dolore adipisci sed dolorem sed non neque.
53,JJ,6,white,medium,1,16,Siamese,5,Breeder,0,Dolore est velit numquam quaerat labore consectetur aliquam.
54,Noodles,6,spotted,medium,0,8,Mutt,6,Breeder,0,Dolore dolore voluptatem etincidunt adipisci neque voluptatem velit.
55,Edgar,6,white,short,0,12,Mutt,21,Breeder,0,Tempora neque quiquia adipisci sit sit modi numquam.
56,Belle,6,white,medium,1,0,Maine Coon,14,Shelter,0,Velit neque etincidunt tempora voluptatem quiquia sed.
57,Cotton,6,orange,short,0,8,Mutt,7,Rescue,1,Neque non tempora etincidunt quiquia.
58,Kira,6,spotted,short,1,20,Persian,15,Shelter,0,Porro quaerat magnam quaerat adipisci.
59,Cookie,6,spotted,long,0,1,Welsh Corgi (Pembroke),8,Breeder,0,Sit sed tempora non velit ipsum numquam.
60,Jelly-bean,6,white,short,1,6,Himalayan,8,Shelter,0,Est quiquia velit magnam ut quaerat.
61,Truffles,7,black,long,1,6,Unknown,14,Breeder,1,Sit quaerat ut consectetur eius modi quaerat dolor.
62,Tiny,7,black,short,0,14,Japanese Spitz,9,Rescue,0,Dolore neque consectetur dolore tempora quaerat consectetur.
63,Wally,7,white,long,1,16,Devon Rex,10,Breeder,0,Eius modi porro sed tempora est quisquam sit.
64,Darby,7,white,medium,0,11,Basset Hound,23,Rescue,0,Ut non dolore dolore sit velit amet quisquam.
65,Spirit,7,black,long,0,4,Whippet,13,Rescue,0,Magnam non adipisci sed labore amet eius aliquam.
66,Sailor,7,spotted,short,0,4,Collie (Smooth),19,Shelter,0,Sit ut voluptatem quaerat neque.
67,Gabby,7,orange,medium,0,1,Borzoi,25,Breeder,0,Labore non etincidunt adipisci aliquam porro.
68,Black-Jack,7,brown,medium,1,5,Siamese,13,Shelter,0,Aliquam dolorem labore modi dolore eius quisquam dolore.
69,Adam,7,brown,short,1,0,Unknown,8,Breeder,0,Porro tempora neque sit labore quisquam.
70,Susie-q,7,white,long,0,6,Dachshund (Miniature Smooth Haired),14,Breeder,0,Tempora sed non neque voluptatem quiquia dolor ut.
71,Willie,8,orange,short,1,1,Unknown,18,Shelter,0,Ipsum ut quiquia dolorem adipisci ipsum.
72,Gilbert,8,black,medium,1,10,Unknown,8,Breeder,0,Est quiquia ipsum labore porro dolor voluptatem est.
73,Pandora,8,spotted,long,0,1,Mutt,24,Shelter,0,Consectetur neque numquam ipsum labore dolorem consectetur porro.
74,Tinker-bell,8,black,short,1,8,Unknown,5,Shelter,0,Tempora aliquam dolorem porro.
75,Figaro,8,orange,medium,1,6,Unknown,16,Breeder,0,Amet sit quaerat amet ut.
76,Scottie,8,brown,long,0,17,Mutt,11,Shelter,0,Quiquia quaerat numquam ut consectetur.
77,Kelly,8,orange,medium,1,16,British Shorthair,11,Breeder,0,Dolor dolore amet voluptatem quisquam dolorem.
78,Walter,8,black,medium,1,8,Unknown,14,Rescue,0,Neque neque est quaerat etincidunt consectetur ut.
79,Kismet,8,black,short,1,8,Abyssinian,10,Rescue,1,Sit eius non labore quiquia consectetur velit.
80,Blast,8,spotted,long,1,19,Unknown,7,Rescue,0,Numquam voluptatem neque labore.
81,Eva,9,orange,long,0,12,Mutt,23,Breeder,1,Dolorem adipisci etincidunt modi aliquam ipsum quiquia.
82,Cubs,9,brown,long,0,0,Beagle,5,Shelter,0,Amet tempora est adipisci dolorem modi tempora.
83,Lucifer,9,orange,medium,1,20,Unknown,6,Shelter,0,Quisquam amet sit porro.
84,Plato,9,brown,medium,1,19,Unknown,12,Rescue,0,Numquam adipisci voluptatem ipsum amet numquam dolorem.
85,Amos,9,brown,short,1,11,Turkish Angora,16,Rescue,0,Velit est amet porro neque velit etincidunt.
86,Norton,9,black,long,0,13,Mutt,6,Breeder,0,Non eius numquam quaerat ipsum non.
87,Jazmie,9,orange,long,0,12,Old English Sheepdog,20,Breeder,0,Non quaerat modi neque.
88,Ripley,9,orange,short,0,16,Tibetan Terrier,21,Shelter,0,Modi etincidunt ut labore est aliquam velit.
89,Brie,9,white,short,1,3,Russian Blue,17,Breeder,0,Numquam etincidunt ipsum eius ipsum.
90,Gizmo,9,orange,short,0,5,Mutt,13,Rescue,0,Voluptatem magnam porro tempora labore.
91,Cheyenne,10,brown,long,1,13,Maine Coon,5,Rescue,0,Non quisquam modi est magnam sed.
92,Wally,10,brown,long,0,4,Mutt,24,Shelter,0,Dolorem est ipsum dolor labore quaerat voluptatem.
93,Charles,10,spotted,medium,0,7,Mutt,7,Shelter,0,Etincidunt quisquam numquam numquam ipsum quisquam dolore tempora.
94,Jenny,10,orange,short,0,12,Mutt,9,Rescue,0,Etincidunt quisquam est est dolore.
95,Rocky,10,brown,medium,1,20,Turkish Angora,14,Rescue,0,Sed dolorem quaerat consectetur sed ut.
96,Tessa,10,spotted,medium,0,6,Great Dane,24,Rescue,0,Magnam adipisci sit sit neque quaerat.
97,Riley,10,black,short,0,2,Mutt,10,Breeder,0,Dolor dolorem etincidunt eius neque dolor porro quisquam.
98,Ozzie,10,brown,long,0,16,Collie (Smooth),14,Rescue,1,Dolor sit quaerat est est non.
99,Tuck,10,spotted,long,0,4,Hungarian Wire-Haired Vizsla,14,Breeder,0,Dolore ipsum etincidunt eius.
100,Cutie-pie,10,brown,long,1,8,Himalayan,13,Rescue,0,Modi sit labore quisquam quaerat dolorem dolor tempora.
101,Wally,11,orange,medium,1,15,Sphynx,18,Rescue,0,Porro tempora adipisci porro modi ipsum.
102,Flakey,11,brown,medium,1,6,Unknown,15,Breeder,0,Adipisci adipisci aliquam est eius.
103,Little Bit,11,black,short,1,4,Turkish Angora,6,Rescue,0,Quaerat labore etincidunt dolorem dolorem velit voluptatem.
104,Linus,11,orange,short,0,6,Mutt,14,Shelter,1,Porro neque numquam tempora.
105,Tinker-bell,11,white,medium,1,4,Russian Blue,14,Breeder,0,Eius dolore tempora consectetur adipisci quiquia.
106,Sable,11,black,long,0,8,Mutt,10,Breeder,0,Velit ut velit magnam ut magnam amet.
107,Kyra,11,spotted,long,0,1,Mutt,8,Breeder,0,Sed neque ipsum ipsum.
108,Birdie,11,spotted,short,0,5,Mutt,11,Breeder,1,Neque numquam velit amet amet numquam non.
109,Gidget,11,white,long,1,2,Burmese,10,Breeder,0,Etincidunt quiquia aliquam quiquia labore velit aliquam tempora.
110,Calvin,11,black,short,1,20,Unknown,10,Shelter,0,Eius amet quaerat sed dolorem porro quisquam etincidunt.
111,Punkin,12,orange,medium,1,14,Unknown,7,Breeder,0,Labore dolore numquam aliquam quisquam numquam porro dolor.
112,Spunky,12,white,medium,0,14,German Short-Haired Pointer,21,Rescue,0,Adipisci labore amet sit modi.
113,Macintosh,12,white,short,1,3,Unknown,15,Breeder,0,Dolorem labore velit velit porro non modi eius.
114,Patty,12,white,short,1,14,Sphynx,11,Breeder,0,Porro dolore voluptatem amet.
115,Ty,12,orange,short,0,12,Mutt,17,Breeder,1,Ipsum adipisci ut est tempora ipsum sit.
116,Tramp,12,black,medium,1,4,Unknown,13,Shelter,0,Velit sed amet est non labore consectetur voluptatem.
117,Pluto,12,white,short,0,15,Bedlington Terrier,17,Shelter,0,Adipisci est amet aliquam ipsum quiquia dolor neque.
118,Little-one,12,orange,medium,0,9,Lhaso Apso,5,Rescue,0,Eius voluptatem labore etincidunt velit dolore.
119,Jolie,12,white,long,0,10,Mutt,14,Shelter,0,Ut aliquam tempora dolore porro ipsum quisquam non.
120,Addie,12,spotted,medium,1,3,Manx,14,Breeder,0,Sit voluptatem magnam eius ipsum eius quiquia numquam.
121,Sage,13,black,long,1,12,Unknown,7,Shelter,0,Quaerat quaerat dolor neque velit numquam dolore sit.
122,Mister,13,orange,long,1,1,Unknown,16,Rescue,0,Etincidunt quiquia velit consectetur ut.
123,Kelly,13,white,medium,0,7,Mutt,10,Rescue,0,Eius voluptatem non quiquia modi.
124,Ladybug,13,spotted,short,1,6,Burmese,9,Shelter,0,Labore neque neque quaerat.
125,June,13,brown,long,0,0,Mutt,17,Shelter,0,Adipisci ipsum eius quiquia.
126,Skippy,13,white,short,1,12,Devon Rex,11,Breeder,0,Numquam non numquam voluptatem quisquam porro.
127,Freeway,13,orange,long,1,8,Unknown,6,Breeder,0,Labore aliquam sit numquam magnam aliquam etincidunt porro.
128,Freedom,13,white,medium,0,1,Mutt,13,Rescue,0,Quaerat tempora sit amet quiquia voluptatem neque quisquam.
129,Scout,13,spotted,medium,0,13,Mutt,12,Rescue,1,Quaerat amet magnam ipsum non neque amet.
130,Thelma,13,brown,long,0,6,Anatolian Shepherd Dog,17,Breeder,0,Labore neque ut modi.
131,Yellow,14,black,short,0,3,Airedale Terrier,7,Rescue,0,Magnam dolor velit sit.
132,Blanche,14,white,medium,1,16,Turkish Van,15,Rescue,0,Dolorem velit modi eius voluptatem eius.
133,Gordon,14,black,short,1,15,Sphynx,5,Shelter,0,Dolorem modi sed numquam adipisci ut consectetur.
134,Charlie,14,black,medium,1,3,Maine Coon,12,Shelter,0,Quisquam quiquia consectetur magnam.
135,Gilda,14,black,short,1,17,British Shorthair,10,Breeder,0,Aliquam dolor dolorem non etincidunt eius magnam eius.
136,Abbie,14,orange,short,0,17,Dachshund (Smooth Haired),8,Rescue,0,Dolorem eius porro quisquam amet sed neque.
137,Barley,14,black,medium,1,8,Unknown,15,Breeder,0,Magnam ut quiquia velit ut.
138,Meggie,14,orange,long,1,4,Unknown,16,Rescue,0,Quiquia labore labore dolore modi ipsum.
139,Codi,14,brown,long,1,20,Scottish Fold,13,Rescue,0,Consectetur quisquam est amet ipsum.
140,Brandi,14,orange,long,0,13,Dachshund (Miniature Wire Haired),16,Rescue,0,Modi dolor porro sed amet amet amet.
141,Brandy,15,brown,medium,1,12,Sphynx,8,Shelter,0,Consectetur magnam sed amet etincidunt.
142,Rocko,15,black,medium,1,14,Scottish Fold,16,Shelter,0,Magnam ut etincidunt quiquia voluptatem.
143,Snuffles,15,orange,long,0,6,Dachshund (Miniature Smooth Haired),24,Breeder,1,Amet voluptatem labore modi quisquam dolor dolor ipsum.
144,Booker,15,orange,long,1,19,Turkish Angora,5,Shelter,0,Non dolore sed porro eius labore.
145,Penny,15,brown,medium,0,15,Papillon,17,Shelter,0,Est quisquam magnam non quiquia.
146,Ladybug,15,brown,short,0,15,Briard,23,Rescue,0,Magnam modi non consectetur magnam aliquam porro velit.
147,Pooch,15,brown,medium,1,11,Unknown,8,Shelter,0,Non voluptatem dolor neque eius.
148,Sheba,15,brown,short,0,10,Mutt,16,Breeder,0,Voluptatem non neque sed aliquam adipisci.
149,Trouble,15,orange,short,0,5,German Spitz Klein,14,Shelter,0,Etincidunt labore sed etincidunt dolorem ut quiquia.
150,Comet,15,spotted,long,0,2,Mutt,5,Breeder,0,Amet ut dolor neque dolorem.
151,Birdy,16,orange,long,1,2,Unknown,9,Shelter,0,Porro ipsum est modi aliquam porro numquam sed.
152,Bruiser,16,black,short,1,2,Siamese,14,Breeder,0,Quaerat velit numquam dolore.
153,Petie,16,spotted,short,0,1,Mutt,13,Shelter,0,Ipsum quiquia adipisci quiquia velit ut.
154,Snuggles,16,spotted,long,0,0,Mutt,15,Rescue,0,Est dolore sed ut etincidunt.
155,Oliver,16,spotted,medium,0,12,Mutt,18,Rescue,0,Voluptatem sit velit neque.
156,Pockets,16,orange,short,0,3,Mutt,22,Rescue,0,Neque quisquam numquam quisquam modi sed ipsum.
157,Henry,16,black,long,1,2,British Shorthair,11,Shelter,0,Velit est dolor labore velit tempora neque.
158,Big Foot,16,brown,medium,0,5,Mutt,13,Rescue,1,Labore adipisci etincidunt consectetur sit quaerat aliquam.
159,Tank,16,spotted,medium,1,15,Unknown,9,Rescue,0,Ut numquam consectetur magnam eius quiquia ut.
160,Dinky,16,spotted,long,0,16,Chow Chow (Smooth),17,Rescue,0,Sed amet eius ipsum sed modi.
161,Jenna,17,brown,long,1,11,Persian,5,Shelter,0,Voluptatem amet numquam quiquia neque.
162,Brownie,17,white,short,1,9,Unknown,6,Shelter,0,Consectetur voluptatem magnam dolorem adipisci labore.
163,Barney,17,black,short,0,5,Mutt,17,Breeder,0,Modi dolore adipisci porro.
164,Chivas,17,white,long,0,11,Poodle Standard,25,Shelter,0,Aliquam est magnam ipsum dolorem.
165,Noodles,17,spotted,long,0,10,Mutt,9,Shelter,0,Tempora quaerat tempora dolor non dolor labore velit.
166,Maxine,17,orange,short,0,13,Mutt,9,Shelter,0,Adipisci aliquam ut quisquam.
167,Pete,17,orange,long,0,16,Mutt,25,Breeder,0,Dolore etincidunt amet sit.
168,Tony,17,spotted,long,0,5,Kerry Blue Terrier,14,Rescue,0,Dolorem labore voluptatem ut voluptatem est.
169,Candy,17,spotted,short,1,19,Himalayan,11,Rescue,0,Amet tempora labore modi amet eius amet.
170,Lassie,17,orange,long,0,19,Mutt,11,Breeder,0,Est eius neque modi sed quiquia.
171,Bob,18,orange,short,0,14,Mutt,14,Breeder,0,Amet quiquia ipsum adipisci numquam numquam neque.
172,Holly,18,black,long,0,4,Bedlington Terrier,11,Shelter,0,Eius sed voluptatem est est.
173,Tyson,18,orange,medium,1,12,Unknown,6,Breeder,0,Aliquam consectetur amet voluptatem quisquam sed magnam.
174,Mitzi,18,spotted,long,1,1,Unknown,10,Rescue,0,Dolor voluptatem magnam dolor tempora quiquia neque dolorem.
175,Mickey,18,orange,short,1,11,Manx,15,Breeder,0,Modi etincidunt quisquam porro tempora dolor modi tempora.
176,Shelby,18,white,medium,0,0,Portuguese Water Dog,25,Breeder,0,Voluptatem dolorem dolore numquam quiquia.
177,Rolex,18,black,long,1,0,Unknown,7,Breeder,0,Adipisci etincidunt quisquam aliquam neque quiquia labore est.
178,Chipper,18,white,medium,1,6,Unknown,12,Breeder,0,Adipisci tempora dolorem dolor magnam dolor dolorem.
179,Booster,18,spotted,medium,0,2,Mutt,5,Shelter,0,Magnam non voluptatem porro.
180,Aldo,18,orange,short,1,6,Unknown,9,Rescue,0,Consectetur aliquam tempora quisquam dolore.
181,Chessie,19,brown,long,1,19,Unknown,13,Rescue,0,Ut est magnam quisquam.
182,Pedro,19,orange,short,0,4,Australian Cattle Dog,5,Shelter,0,Porro dolor velit dolorem labore quiquia.
183,Plato,19,orange,long,0,1,West Highland White Terrier,13,Rescue,0,Quaerat non amet porro ut dolor.
184,Napoleon,19,spotted,short,0,16,Maremma Sheepdog,25,Shelter,0,Magnam numquam aliquam sed.
185,Ivy,19,orange,short,0,18,Mutt,25,Breeder,0,Modi sed dolorem consectetur quisquam tempora.
186,Corky,19,black,long,1,11,Abyssinian,16,Shelter,0,Tempora magnam ut voluptatem.
187,Raven,19,brown,short,1,12,Turkish Angora,9,Rescue,0,Porro dolorem sit quaerat quaerat quaerat sed ut.
188,Samson,19,white,short,1,0,Scottish Fold,12,Breeder,0,Est labore amet voluptatem adipisci.
189,Petie,19,white,medium,0,9,Samoyed,8,Shelter,0,Sed quaerat non aliquam dolor aliquam consectetur quisquam.
190,Casper,19,black,long,0,17,Dobermann,25,Rescue,0,Quiquia sit etincidunt amet quaerat sit porro.
191,Kiwi,20,spotted,medium,1,14,Unknown,6,Breeder,1,Labore magnam dolor adipisci etincidunt ut sit tempora.
192,Fiona,20,black,short,1,8,Unknown,18,Breeder,0,Numquam dolor quaerat quisquam dolorem magnam dolore magnam.
193,Popcorn,20,white,long,0,11,Mutt,21,Rescue,0,Porro quiquia amet modi voluptatem tempora sit.
194,JR,20,white,medium,0,10,Bichon Frise,24,Breeder,0,Dolore porro consectetur neque modi aliquam.
195,Aj,20,white,long,0,9,German Spitz Klein,20,Shelter,0,Neque voluptatem dolore dolore.
196,Nicky,20,brown,medium,1,18,Himalayan,14,Shelter,0,Voluptatem ipsum dolor est neque.
197,Cocoa,20,orange,short,1,10,Unknown,16,Rescue,0,Amet amet sed aliquam sed magnam voluptatem.
198,Guy,20,white,long,1,15,Unknown,11,Shelter,1,Quisquam ut sit consectetur.
199,Guido,20,white,long,0,13,Mutt,9,Breeder,0,Quiquia labore est amet.
200,Skip,20,brown,short,1,18,Manx,8,Shelter,0,Modi etincidunt adipisci voluptatem.
201,Chips,21,spotted,long,1,19,Unknown,7,Shelter,0,Ipsum est voluptatem aliquam ipsum.
202,Wesley,21,orange,medium,1,7,Unknown,15,Rescue,0,Neque dolore labore sit porro porro.
203,Marley,21,white,short,1,19,Siamese,15,Breeder,0,Voluptatem est eius quisquam.
204,Bruno,21,spotted,long,0,5,Mutt,8,Breeder,0,Adipisci dolore ut quisquam est etincidunt quaerat voluptatem.
205,Rocco,21,black,long,0,8,Mutt,8,Rescue,0,Sit dolore quiquia consectetur.
206,Mojo,21,black,short,1,14,Unknown,16,Breeder,0,Dolorem dolorem dolorem tempora amet porro.
207,Piper,21,spotted,medium,0,14,Mutt,21,Shelter,0,Voluptatem etincidunt adipisci porro.
208,Bear,21,black,medium,0,20,Mutt,7,Shelter,0,Non sit labore magnam sed labore.
209,Jackie,21,spotted,long,1,0,Unknown,10,Shelter,0,Consectetur quaerat est amet est dolore sit eius.
210,KC,21,black,short,1,0,Turkish Van,5,Breeder,0,Magnam amet est neque dolor quisquam quisquam est.
211,Lefty,22,orange,medium,1,15,Unknown,16,Rescue,0,Neque est quaerat quisquam magnam sit etincidunt sit.
212,Nala,22,white,short,1,17,Unknown,10,Breeder,0,Sed consectetur non neque.
213,Yukon,22,brown,long,0,4,Mutt,17,Breeder,0,Labore quiquia modi porro sit.
214,Spirit,22,brown,medium,1,7,Siamese,14,Breeder,0,Sed modi est dolore aliquam est dolor voluptatem.
215,Leo,22,orange,short,1,1,Sphynx,14,Breeder,0,Dolor modi dolorem dolore est quaerat numquam.
216,Phantom,22,spotted,medium,0,4,Mutt,23,Breeder,0,Neque numquam quisquam amet voluptatem.
217,Calvin,22,black,long,0,10,Mutt,20,Rescue,0,Numquam consectetur voluptatem non quaerat.
218,Jewels,22,orange,short,1,18,Maine Coon,12,Breeder,0,Labore quaerat quaerat numquam consectetur.
219,Piggy,22,black,long,0,10,Bernese Mountain Dog,19,Breeder,0,Est amet porro non numquam non eius quisquam.
220,Hallie,22,brown,long,0,20,Soft Coated Wheaten Terrier,15,Breeder,0,Velit numquam ipsum ipsum adipisci quiquia sed voluptatem.
221,Dempsey,23,black,medium,1,15,Abyssinian,7,Breeder,0,Eius ut aliquam sit dolor non.
222,Duncan,23,white,medium,1,0,Unknown,18,Breeder,0,Voluptatem voluptatem numquam velit ut consectetur consectetur porro.
223,Little-rascal,23,spotted,medium,1,13,Scottish Fold,16,Shelter,0,Etincidunt velit consectetur magnam tempora.
224,Roxie,23,spotted,long,1,10,Burmese,5,Breeder,0,Porro tempora voluptatem adipisci.
225,Sasha,23,brown,long,1,2,Unknown,16,Breeder,0,Est quiquia dolore numquam.
226,Rosa,23,white,short,0,4,Mutt,21,Shelter,1,Quiquia tempora amet dolorem aliquam aliquam dolor.
227,Tasha,23,white,short,1,19,Unknown,7,Rescue,0,Est quaerat velit modi tempora ipsum.
228,Stanley,23,spotted,short,1,14,Manx,16,Rescue,0,Voluptatem dolore dolor quiquia aliquam.
229,Buddy,23,spotted,medium,0,4,Bracco Italiano,21,Shelter,0,Quisquam ut sit numquam.
230,Bailey,23,spotted,short,0,8,Poodle Standard,25,Shelter,0,Voluptatem sed numquam numquam consectetur quiquia numquam.
231,Faith,24,orange,medium,1,1,Unknown,13,Breeder,0,Dolore labore quaerat neque tempora magnam numquam.
232,Susie,24,black,medium,1,8,Siamese,12,Shelter,0,Adipisci sed eius labore.
233,Fonzie,24,orange,short,1,19,Himalayan,16,Breeder,0,Dolorem ipsum dolorem numquam sed dolor voluptatem.
234,Clyde,24,orange,short,0,17,Mutt,6,Rescue,0,Adipisci numquam tempora labore etincidunt ipsum ut dolorem.
235,Peppy,24,spotted,medium,1,7,Unknown,18,Breeder,0,Dolore ut modi amet amet velit.
236,Winnie,24,orange,short,0,1,French Bulldog,9,Breeder,1,Quaerat adipisci ipsum neque neque non neque.
237,Clicker,24,white,long,1,4,Maine Coon,6,Breeder,0,Velit magnam labore quiquia quiquia aliquam velit.
238,Nina,24,orange,short,1,8,Manx,7,Shelter,0,Labore consectetur velit amet tempora ipsum quisquam.
239,Fifi,24,brown,long,0,16,Mutt,9,Rescue,0,Labore quiquia dolor ipsum neque.
240,Sebastian,24,orange,short,1,7,Unknown,7,Rescue,0,Dolor neque sed quaerat quaerat dolor.
241,Klaus,25,white,short,1,13,Unknown,5,Shelter,0,Tempora magnam tempora dolorem.
242,Shiner,25,brown,long,0,5,Norwich Terrier,11,Breeder,0,Est aliquam porro etincidunt velit.
243,Buttercup,25,brown,short,1,10,Unknown,10,Rescue,0,Amet sit modi dolore.
244,Gavin,25,spotted,short,0,8,Mutt,17,Rescue,0,Quiquia non magnam voluptatem velit.
245,Jake,25,black,long,0,16,Mutt,17,Rescue,0,Quisquam magnam est amet.
246,Daffy,25,orange,medium,0,8,Mutt,9,Shelter,0,Dolorem dolore tempora ut.
247,Honey,25,spotted,long,1,1,Turkish Angora,5,Breeder,0,Velit voluptatem est sit est quaerat non numquam.
248,Tess,25,spotted,medium,1,4,Unknown,9,Breeder,0,Est numquam etincidunt neque est dolore.
249,Mitzi,25,brown,short,0,1,Mutt,19,Rescue,0,Aliquam dolor adipisci ut.
250,Loki,25,brown,medium,1,6,Cornish Rex,16,Breeder,1,Labore aliquam porro modi neque dolorem.
251,Mona,26,spotted,short,1,17,British Shorthair,13,Shelter,0,Modi quaerat eius adipisci tempora eius non.
252,Lady,26,black,short,0,4,Australian Shepherd Dog,10,Rescue,0,Quiquia etincidunt magnam sed.
253,Brit,26,orange,long,0,1,Australian Cattle Dog,8,Shelter,0,Neque porro consectetur tempora modi dolore.
254,Spencer,26,spotted,long,0,4,Bull Terrier Miniature,17,Rescue,0,Sit adipisci quisquam etincidunt dolorem velit amet.
255,Ernie,26,orange,short,0,1,Norfolk Terrier,10,Breeder,0,Ut porro ipsum eius dolor quaerat neque.
256,Norton,26,brown,long,0,19,Australian Shepherd Dog,9,Breeder,0,Adipisci eius modi consectetur sed sed ipsum.
257,Nico,26,black,medium,0,17,Lhaso Apso,13,Shelter,0,Quiquia sed quisquam dolor sit.
258,Chanel,26,spotted,short,1,12,British Shorthair,11,Shelter,0,Velit magnam quaerat est ipsum sit quisquam neque.
259,Cricket,26,black,medium,1,9,Devon Rex,15,Rescue,0,Sed modi dolorem non aliquam porro.
260,Max,26,black,short,0,5,Mutt,15,Rescue,0,Ipsum adipisci dolore quisquam dolore quiquia.
261,Sherman,27,spotted,long,1,9,Unknown,11,Shelter,0,Dolor tempora velit aliquam tempora ipsum quaerat.
262,Mocha,27,orange,long,0,11,Mutt,24,Shelter,0,Quisquam consectetur quisquam velit velit.
263,Crystal,27,white,long,0,8,German Short-Haired Pointer,11,Rescue,0,Tempora labore etincidunt neque amet.
264,Diamond,27,spotted,long,1,2,Himalayan,7,Breeder,0,Adipisci ipsum aliquam aliquam.
265,Wayne,27,orange,long,1,3,Russian Blue,18,Shelter,0,Dolor voluptatem quisquam amet.
266,Babykins,27,black,long,0,3,Mutt,6,Rescue,0,Labore dolorem ipsum adipisci neque non.
267,Yin,27,white,long,1,16,Cornish Rex,14,Shelter,0,Quaerat neque quiquia etincidunt porro.
268,Bosley,27,brown,medium,1,6,Turkish Van,6,Shelter,0,Dolorem dolor aliquam tempora dolor quiquia voluptatem amet.
269,Ruger,27,brown,short,1,5,Unknown,6,Shelter,0,Tempora est magnam adipisci etincidunt adipisci etincidunt.
270,Yang,27,black,medium,1,12,Unknown,11,Shelter,0,Sed etincidunt quaerat eius.
271,Hammer,28,orange,short,1,15,Manx,16,Breeder,0,Sit ipsum adipisci quisquam dolor quisquam eius ipsum.
272,Megan,28,black,medium,0,17,Mutt,12,Rescue,0,Velit voluptatem labore porro quaerat voluptatem voluptatem sed.
