361,Kelsey,37,361,brown,long,Sit ipsum modi sed amet.
362,Babe,37,362,white,long,Quisquam etincidunt sed non tempora quaerat numquam amet.
363,Lassie,37,363,orange,short,Quaerat quaerat voluptatem magnam numquam quaerat.
364,Toffee,37,364,spotted,medium,Labore non adipisci ipsum eius ipsum eius.
365,Finnegan,37,365,orange,medium,Adipisci porro magnam sit numquam.
366,Skye,37,366,spotted,long,Tempora tempora labore dolorem sed tempora amet porro.
367,Cricket,37,367,black,long,Amet eius sit quiquia.
368,Kramer,37,368,brown,medium,Ut ipsum sit modi sit.
369,Fluffy,37,369,orange,long,Amet neque velit eius magnam modi sed velit.
370,Ricky,37,370,black,short,Voluptatem sit consectetur numquam dolor amet quaerat est.
371,Oscar,38,371,orange,short,Amet est voluptatem velit est ipsum sed dolore.
372,Butterball,38,372,white,long,Magnam aliquam voluptatem velit dolor ipsum eius.
373,Coconut,38,373,brown,short,Non dolor consectetur dolorem.
374,Barclay,38,374,black,medium,Porro non porro sit.
375,Jerry,38,375,brown,short,Eius quisquam modi ipsum.
376,Sabine,38,376,brown,short,Voluptatem aliquam neque est sed etincidunt quiquia tempora.
377,Aires,38,377,white,medium,Quaerat aliquam consectetur adipisci.
378,Nutmeg,38,378,white,short,Adipisci adipisci velit etincidunt dolor aliquam.
379,Humphrey,38,379,brown,medium,Ipsum modi aliquam aliquam dolore.
380,Prince,38,380,spotted,medium,Non etincidunt numquam dolor dolor quisquam etincidunt.
381,Olive,39,381,white,long,Ut ut sit amet numquam.
382,Alfie,39,382,spotted,medium,Ut dolorem labore etincidunt neque.
383,Godiva,39,383,spotted,long,Quiquia amet neque consectetur ipsum dolore porro sed.
384,Kiwi,39,384,spotted,short,Non labore magnam amet non consectetur adipisci.
385,Pumpkin,39,385,black,medium,Labore consectetur non numquam porro numquam.
386,Frosty,39,386,black,long,Neque ipsum quiquia velit.
387,Ben,39,387,brown,short,Neque eius sed modi aliquam neque.
388,Barclay,39,388,brown,short,Magnam voluptatem modi adipisci.
389,Eddy,39,389,orange,short,Tempora neque ipsum neque ut.
390,Foxy,39,390,orange,medium,Sed non ut quaerat.
391,Dallas,40,391,black,short,Quiquia labore quiquia dolor quisquam magnam adipisci.
392,Shiner,40,392,black,medium,Sed velit non amet labore dolore magnam.
393,Genie,40,393,white,medium,Modi sit neque velit tempora adipisci numquam tempora.
394,Cyrus,40,394,spotted,short,Porro ipsum consectetur neque sed ipsum.
395,Brook,40,395,spotted,short,Dolor ipsum ipsum dolorem dolorem aliquam dolor dolor.
396,Atlas,40,396,spotted,short,Labore dolore sit adipisci numquam.
397,Newton,40,397,spotted,medium,Porro labore adipisci quaerat sed.
398,Binky,40,398,spotted,medium,Voluptatem etincidunt magnam ut quisquam sed non aliquam.
399,Bridgette,40,399,white,short,Dolore quiquia dolorem adipisci ut neque.
400,Pete,40,400,white,medium,Aliquam quisquam eius consectetur.
401,Coconut,41,401,white,short,Labore amet non tempora.
402,Capone,41,402,orange,medium,Adipisci ipsum ut quisquam numquam adipisci non.
403,Wags,41,403,white,long,Porro tempora quiquia est.
404,Levi,41,404,white,medium,Non est sit dolorem.
405,Pretty-girl,41,405,white,medium,Porro tempora consectetur neque.
406,Bam-bam,41,406,black,long,Quisquam etincidunt labore est numquam numquam velit.
407,Paris,41,407,black,long,Ut aliquam ut voluptatem.
408,Bud,41,408,white,short,Voluptatem dolore neque aliquam voluptatem tempora.
409,Miles,41,409,black,short,Tempora quisquam velit consectetur.
410,Sydney,41,410,orange,medium,Labore amet aliquam sit dolorem neque est aliquam.
411,Yaka,42,411,spotted,short,Sed eius sit voluptatem porro.
412,Mugsy,42,412,white,short,Velit velit ipsum adipisci.
413,Ginger,42,413,white,long,Quiquia dolore magnam est tempora adipisci labore.
414,Georgia,42,414,black,medium,Aliquam ipsum dolore velit.
415,Elliot,42,415,brown,short,Dolor dolorem ipsum ipsum quiquia quisquam.
416,Brodie,42,416,spotted,medium,Etincidunt ipsum labore quiquia ut quiquia.
417,Kiwi,42,417,white,long,Labore dolore eius quaerat neque neque.
418,Troy,42,418,white,medium,Dolore adipisci consectetur consectetur numquam tempora adipisci est.
419,Jingles,42,419,orange,short,Voluptatem tempora consectetur adipisci consectetur.
420,Dutches,42,420,brown,short,Amet amet neque eius.
421,Einstein,43,421,spotted,short,Eius modi eius magnam.
422,Wallace,43,422,brown,short,Ut ipsum numquam porro ut.
423,George,43,423,black,medium,Non aliquam amet adipisci ut.
424,Buster-brown,43,424,black,long,Ipsum numquam aliquam est numquam.
425,Armanti,43,425,white,long,Consectetur quisquam modi sed sit dolorem.
426,Fuzzy,43,426,brown,medium,Est tempora adipisci sed modi aliquam non.
427,Bubbles,43,427,spotted,long,Quisquam tempora tempora adipisci dolorem magnam.
428,Abbie,43,428,spotted,long,Ut non neque non dolor.
429,Mariah,43,429,white,long,Sit dolor quisquam quiquia tempora modi.
430,Pumpkin,43,430,orange,short,Modi dolore tempora neque modi non tempora.
431,Tasha,44,431,white,medium,Sed modi dolorem velit adipisci consectetur quaerat sit.
432,Aries,44,432,white,medium,Sed quaerat etincidunt consectetur sit amet.
433,Fancy,44,433,orange,medium,Adipisci amet sit magnam ut.
434,Phoebe,44,434,orange,short,Modi ut tempora labore eius aliquam.
435,Aggie,44,435,brown,medium,Voluptatem non magnam dolor.
436,Cutie,44,436,white,medium,Eius dolor non quaerat ipsum dolor.
437,Wolfgang,44,437,black,medium,Magnam voluptatem aliquam velit sed neque quaerat.
438,Capone,44,438,spotted,medium,Non quaerat quisquam aliquam.
439,Kyra,44,439,black,short,Quisquam sed amet eius porro.
440,Rolex,44,440,spotted,medium,Ipsum porro tempora numquam sit quisquam labore est.
441,Emmy,45,441,spotted,short,Quaerat numquam quiquia magnam velit dolor sed.
442,Koba,45,442,orange,medium,Tempora ipsum sit sed tempora velit numquam ut.
443,Snoopy,45,443,spotted,long,Consectetur est sit quisquam numquam ipsum.
444,Jester,45,444,orange,short,Quiquia quiquia modi tempora quiquia.
445,Mulligan,45,445,spotted,long,Labore non ipsum dolorem sed.
446,Blondie,45,446,spotted,long,Ut porro quiquia dolor quisquam numquam sit non.
447,Tramp,45,447,black,medium,Dolore eius modi aliquam est quiquia eius velit.
448,Thor,45,448,white,medium,Modi etincidunt adipisci sit adipisci.
449,Raven,45,449,black,long,Non consectetur labore magnam consectetur dolore consectetur.
450,Iris,45,450,white,short,Ipsum quisquam numquam amet magnam voluptatem dolorem.
451,Candy,46,451,black,long,Sit magnam labore voluptatem.
452,Pumpkin,46,452,orange,long,Quiquia quiquia etincidunt aliquam adipisci est eius neque.
453,Coco,46,453,spotted,medium,Est est eius eius dolor porro.
454,Dobie,46,454,black,long,Magnam amet tempora quaerat.
455,Griffen,46,455,white,medium,Non labore ut dolore.
456,Cobweb,46,456,spotted,medium,Porro aliquam velit sit.
457,Beau,46,457,spotted,long,Non amet sit quisquam quisquam dolor.
458,Dexter,46,458,white,short,Magnam quisquam sed labore.
459,Birdy,46,459,white,long,Magnam amet velit dolor adipisci quisquam amet dolor.
460,Buffie,46,460,orange,short,Neque amet porro labore dolorem neque quaerat modi.
461,Yogi-bear,47,461,brown,medium,Ipsum porro non magnam consectetur.
462,Westie,47,462,orange,long,Non labore dolor sit ipsum adipisci.
463,Tabby,47,463,black,long,Aliquam quaerat porro amet labore quisquam porro.
464,Darby,47,464,brown,short,Modi tempora sit ipsum dolor porro modi quisquam.
465,Daisey-mae,47,465,orange,short,Quaerat etincidunt neque sit est.
466,Mister,47,466,spotted,long,Adipisci modi non numquam neque ipsum aliquam adipisci.
467,Tobie,47,467,orange,long,Sit sit neque consectetur numquam est.
468,Jelly-bean,47,468,orange,long,Adipisci est consectetur ut consectetur neque.
469,Nutmeg,47,469,brown,long,Modi porro amet dolor.
470,Boss,47,470,black,medium,Adipisci porro neque quaerat consectetur quisquam.
471,Lexus,48,471,brown,medium,Dolore sed est consectetur.
472,Ricky,48,472,black,long,Velit etincidunt dolorem dolore.
473,Woody,48,473,black,long,Ipsum velit ipsum etincidunt amet est.
474,Chi Chi,48,474,spotted,long,Tempora non amet aliquam magnam.
475,Jewel,48,475,spotted,medium,Non adipisci sit sed quisquam non sed labore.
476,Cassis,48,476,orange,long,Dolore magnam eius ipsum ipsum etincidunt.
477,Judy,48,477,brown,long,Sed quisquam etincidunt quaerat dolorem quiquia sit.
478,Mini,48,478,black,long,Consectetur modi dolor quisquam.
479,Cisco,48,479,brown,short,Sit dolore dolor sed dolorem.
480,Mojo,48,480,brown,medium,Voluptatem ipsum quaerat quisquam numquam.
481,Snoop,49,481,black,long,Amet porro labore consectetur.
482,Bully,49,482,white,medium,Quaerat quiquia porro amet tempora amet tempora.
483,Quincy,49,483,spotted,long,Neque velit quaerat numquam dolorem etincidunt.
484,Lucas,49,484,orange,short,Aliquam est voluptatem est.
485,Pandora,49,485,brown,short,Quaerat ut ut ipsum neque numquam voluptatem.
486,Tabetha,49,486,brown,medium,Neque eius modi amet ut tempora porro sed.
487,Riggs,49,487,black,long,Amet porro voluptatem adipisci.
488,Ivory,49,488,brown,medium,Quisquam aliquam eius consectetur ut tempora ipsum.
489,Faith,49,489,white,medium,Sit quaerat labore adipisci.
490,Franky,49,490,orange,medium,Sit sed quiquia ipsum numquam magnam voluptatem porro.
491,Francais,50,491,white,long,Dolor quiquia aliquam ut ipsum non dolore dolorem.
492,Vegas,50,492,white,short,Non non quaerat quiquia porro porro neque dolore.
493,Genie,50,493,black,short,Magnam dolore magnam aliquam voluptatem ipsum quisquam consectetur.
494,Tucker,50,494,white,long,Quaerat modi porro porro sed neque non labore.
495,Frodo,50,495,brown,short,Labore quaerat voluptatem non modi ut ut.
496,Carley,50,496,brown,medium,Quisquam numquam aliquam voluptatem ut.
497,Deacon,50,497,orange,long,Labore consectetur labore quisquam.
498,Sawyer,50,498,black,long,Velit quaerat non adipisci.
499,Winter,50,499,orange,short,Neque quiquia labore labore dolor consectetur numquam dolore.
500,Dino,50,500,spotted,medium,Ipsum quiquia neque labore sit.
501,Rufus,51,501,white,medium,Dolore aliquam quaerat sed non est.
502,Tootsie,51,502,spotted,short,Modi quiquia quaerat sit ut sed.
503,Riggs,51,503,black,short,Quiquia modi etincidunt tempora eius.
504,Tessie,51,504,black,long,Ipsum numquam ut tempora dolor aliquam.
505,Butterball,51,505,white,long,Dolore ipsum porro adipisci dolore dolorem velit quaerat.
506,Ralph,51,506,spotted,long,Non sed non non dolor ut dolorem tempora.
507,Gypsy,51,507,brown,short,Quiquia est non consectetur dolore quiquia dolorem dolor.
508,Gasby,51,508,white,long,Labore sit amet tempora etincidunt quisquam consectetur.
509,Cisco,51,509,white,short,Dolore ut neque amet modi labore.
510,Francais,51,510,brown,long,Tempora dolor dolore etincidunt voluptatem sit labore sit.
511,Casper,52,511,brown,long,Labore modi voluptatem ipsum ipsum tempora magnam.
512,Riggs,52,512,spotted,medium,Modi modi sit sit non consectetur.
513,Ryder,52,513,orange,long,Aliquam numquam quisquam adipisci quisquam sit aliquam magnam.
514,Gus,52,514,spotted,long,Tempora quaerat dolorem dolore.
515,Trouble,52,515,brown,long,Velit quaerat quiquia porro quisquam velit quisquam.
516,Mouse,52,516,black,medium,Dolorem est magnam etincidunt dolor porro velit.
517,Itsy,52,517,brown,long,Magnam voluptatem sed velit sed.
518,Dylan,52,518,brown,medium,Aliquam velit consectetur neque velit sit magnam.
519,Magic,52,519,brown,medium,Non adipisci dolor quiquia neque est.
520,Gus,52,520,orange,long,Consectetur sit amet est velit dolor amet.
521,Smudge,53,521,spotted,short,Velit est tempora neque numquam est magnam.
522,Hooch,53,522,black,short,Quaerat quisquam quaerat etincidunt ipsum.
523,Newton,53,523,white,short,Non amet quisquam dolore dolore adipisci consectetur.
524,Champ,53,524,orange,medium,Quisquam porro sed amet.
525,Paddy,53,525,brown,long,Quaerat magnam eius quisquam ipsum.
526,Brownie,53,526,brown,short,Sit quaerat neque labore ut quisquam.
527,Earl,53,527,white,short,Neque ipsum etincidunt quaerat quiquia etincidunt non quisquam.
528,Rocco,53,528,white,short,Etincidunt tempora eius aliquam sed.
529,Missie,53,529,white,long,Ipsum neque non labore.
530,Moocher,53,530,spotted,short,Dolor velit amet etincidunt dolorem amet modi quiquia.
531,Dots,54,531,black,long,Quisquam sit adipisci voluptatem numquam velit.
532,Giant,54,532,brown,long,Consectetur adipisci amet ipsum aliquam tempora dolorem dolor.
533,Baron,54,533,orange,long,Dolorem sed neque etincidunt.
534,Julius,54,534,orange,short,Consectetur ipsum adipisci ipsum.
535,Rolex,54,535,spotted,medium,Amet dolor ut sed sed dolorem ipsum.
536,Abby,54,536,orange,long,Amet dolor velit aliquam.
537,Ruffles,54,537,black,short,Modi neque quisquam sed.
538,Popcorn,54,538,spotted,long,Amet dolor eius labore.
539,Little Bit,54,539,brown,medium,Porro dolore magnam labore neque.
540,Flash,54,540,spotted,short,Sit consectetur non ipsum quiquia etincidunt voluptatem.
541,Bebe,55,541,spotted,long,Amet est dolor ipsum consectetur.
542,Truffles,55,542,white,medium,Aliquam neque eius est ut etincidunt ipsum.
543,Jewels,55,543,white,short,Tempora voluptatem quaerat dolore amet.
544,Reilly,55,544,black,short,Est amet tempora numquam labore.
545,Rosebud,55,545,brown,medium,Ipsum non etincidunt ipsum.
546,Ivy,55,546,black,long,Sed amet ut voluptatem labore est magnam.
547,Wags,55,547,black,short,Neque dolor velit quisquam quiquia quaerat dolore.
548,Tuck,55,548,orange,long,Ut sit aliquam ipsum.
549,Maxine,55,549,white,long,Velit quaerat velit quiquia sed dolor.
550,Miasy,55,550,white,short,Porro tempora aliquam sed etincidunt ut sed dolorem.
551,Chaos,56,551,black,medium,Numquam eius non consectetur ipsum.
552,Louie,56,552,white,medium,Magnam aliquam non dolor dolor dolore dolorem.
553,Oliver,56,553,spotted,short,Adipisci eius magnam dolore numquam eius voluptatem.
554,Angus,56,554,white,short,Dolorem ipsum numquam quiquia quiquia velit.
555,Poochie,56,555,brown,medium,Dolorem voluptatem dolorem adipisci.
556,Rocket,56,556,orange,long,Consectetur modi ipsum numquam porro.
557,Tuck,56,557,brown,short,Quiquia quaerat sed dolor voluptatem.
558,Wizard,56,558,brown,medium,Neque amet sit numquam numquam dolor quisquam.
559,Sandy,56,559,orange,short,Quiquia porro quaerat tempora.
560,Tucker,56,560,brown,medium,Dolore sed consectetur aliquam amet.
561,Butterscotch,57,561,white,long,Neque porro neque porro labore eius adipisci amet.
562,Hercules,57,562,brown,long,Consectetur labore eius consectetur porro ipsum tempora dolore.
563,Sarah,57,563,spotted,long,Modi neque quaerat porro est dolore porro.
564,Copper,57,564,brown,long,Voluptatem ipsum quiquia numquam ipsum modi.
565,Zeus,57,565,black,medium,Sed dolorem est ut aliquam non quaerat.
566,Faith,57,566,spotted,long,Ipsum est non labore sed amet.
567,Skip,57,567,black,medium,Porro numquam non sed.
568,Skippy,57,568,spotted,long,Labore quiquia modi quisquam amet.
569,Scooby,57,569,orange,medium,Sit porro adipisci tempora quaerat est.
570,Weaver,57,570,orange,medium,Quaerat sed est magnam labore modi quaerat modi.
571,Winnie,58,571,black,long,Tempora aliquam dolorem dolor amet sed velit velit.
572,Waddles,58,572,spotted,long,Est velit dolore aliquam neque modi numquam.
573,Lightning,58,573,spotted,short,Modi voluptatem neque dolorem.
574,Tank,58,574,white,short,Dolorem amet amet consectetur tempora aliquam aliquam.
575,Brittany,58,575,orange,long,Amet voluptatem numquam adipisci.
576,Jolie,58,576,black,long,Tempora ut ipsum ut labore.
577,Pippy,58,577,orange,medium,Ipsum velit ipsum modi tempora sed amet sed.
578,Brutus,58,578,brown,medium,Etincidunt labore neque dolore est dolor quisquam eius.
579,Babbles,58,579,white,short,Quiquia voluptatem magnam sed velit dolor porro.
580,Smokey,58,580,orange,short,Adipisci eius dolor modi non quaerat neque velit.
581,Jester,59,581,black,short,Dolor quiquia sed numquam quisquam dolor aliquam quaerat.
582,Mason,59,582,spotted,long,Quaerat consectetur modi dolor ipsum.
583,Aldo,59,583,spotted,long,Etincidunt non modi voluptatem tempora.
584,Wrigley,59,584,white,short,Eius aliquam neque labore dolore voluptatem porro.
585,Gracie,59,585,spotted,long,Adipisci quiquia aliquam voluptatem quisquam ipsum.
586,Elliot,59,586,white,medium,Labore quaerat dolore quisquam aliquam adipisci adipisci.
587,Skeeter,59,587,spotted,long,Sed amet tempora eius quaerat.
588,Admiral,59,588,brown,long,Adipisci non non magnam amet ut.
589,Klaus,59,589,white,medium,Dolor dolorem modi dolor quaerat amet.
590,Kallie,59,590,brown,long,Sit porro velit dolore est non consectetur.
591,Ellie,60,591,orange,medium,Magnam amet est quiquia labore ipsum porro est.
592,Sweetie,60,592,brown,short,Modi adipisci non ipsum modi numquam amet quaerat.
593,Natasha,60,593,orange,short,Amet neque est quisquam quaerat.
594,Porch,60,594,black,short,Dolore dolorem amet tempora.
595,Moocher,60,595,orange,medium,Amet aliquam velit sit porro ut adipisci.
596,Chic,60,596,orange,long,Dolorem amet aliquam labore quiquia ipsum labore amet.
597,Chance,60,597,orange,long,Etincidunt sit ipsum ipsum modi labore dolore quiquia.
598,Sable,60,598,white,long,Amet quaerat magnam sit consectetur quisquam sed voluptatem.
599,Topaz,60,599,orange,long,Magnam tempora ipsum sed tempora quisquam numquam.
600,Gunther,60,600,spotted,short,Etincidunt sit quisquam velit numquam amet.
601,Bruiser,61,601,spotted,long,Voluptatem ipsum quiquia tempora consectetur quiquia sit.
602,Ginger,61,602,spotted,medium,Ut tempora magnam sed quaerat.
603,Dragster,61,603,black,medium,Quiquia tempora quisquam numquam quaerat.
604,Wolfgang,61,604,black,short,Sed porro sed quaerat non.
605,Pooh-bear,61,605,brown,medium,Neque tempora consectetur est consectetur sed neque velit.
606,Greenie,61,606,black,long,Consectetur dolore adipisci ipsum sit.
607,Sophie,61,607,orange,short,Consectetur velit quisquam est numquam est sed.
608,Black-Jack,61,608,spotted,medium,Etincidunt modi sit dolore amet quiquia consectetur.
609,Jetta,61,609,brown,medium,Est est numquam consectetur non ut dolore aliquam.
610,Rambler,61,610,brown,medium,Tempora aliquam voluptatem magnam est.
611,Admiral,62,611,orange,long,Quisquam dolor neque quisquam numquam voluptatem aliquam.
612,Julius,62,612,orange,short,Dolor etincidunt quaerat quiquia.
613,Casper,62,613,black,medium,Dolore aliquam labore porro velit adipisci.
614,Kid,62,614,brown,medium,Ipsum consectetur etincidunt tempora quaerat.
615,Koty,62,615,spotted,medium,Labore porro neque porro.
616,Duffy,62,616,orange,medium,Quisquam quiquia modi sed aliquam labore.
617,Star,62,617,black,long,Dolore voluptatem numquam adipisci quiquia eius velit aliquam.
618,Chyna,62,618,brown,medium,Aliquam voluptatem quaerat non eius quisquam dolorem aliquam.
619,Jackpot,62,619,orange,medium,Aliquam consectetur labore etincidunt sit quaerat etincidunt velit.
620,Sienna,62,620,white,long,Eius labore etincidunt dolor voluptatem.
621,Princess,63,621,black,medium,Tempora quiquia ipsum aliquam eius ipsum modi numquam.
622,Goldie,63,622,brown,short,Quiquia eius ut tempora ipsum amet.
623,Pearl,63,623,orange,long,Ut non sed neque amet.
624,Barnaby,63,624,orange,short,Quaerat ipsum modi non ipsum labore.
625,KC,63,625,orange,medium,Dolor quisquam dolorem velit.
626,Tessie,63,626,orange,long,Modi dolore amet eius sed est quaerat non.
627,Paco,63,627,white,long,Dolorem eius est ut quiquia.
628,Doggon’,63,628,spotted,short,Amet dolore numquam sit.
629,Dude,63,629,orange,medium,Ut amet non amet numquam.
630,Kismet,63,630,spotted,short,Quaerat magnam eius neque consectetur ipsum.
631,Whispy,64,631,spotted,short,Etincidunt aliquam aliquam dolore numquam voluptatem amet ipsum.
632,Pearl,64,632,white,short,Magnam dolore quiquia labore magnam ipsum dolor.
633,Bubba,64,633,orange,long,Porro voluptatem non tempora dolor magnam dolor voluptatem.
634,Chip,64,634,brown,medium,Quiquia modi dolore quiquia non.
635,Allie,64,635,black,short,Etincidunt dolor magnam velit quisquam.
636,Birdie,64,636,orange,short,Etincidunt quiquia porro aliquam tempora dolore non.
637,Apollo,64,637,white,medium,Magnam dolore etincidunt velit.
638,Rocco,64,638,black,long,Dolor non est sed consectetur amet non ut.
639,Abbey,64,639,spotted,medium,Modi sit non amet eius numquam non etincidunt.
640,Gretel,64,640,black,medium,Dolor dolore sed dolore neque tempora modi.
641,Summer,65,641,orange,short,Amet modi non dolore quisquam.
642,Monkey,65,642,orange,medium,Magnam ipsum ipsum modi numquam dolor sit.
643,Smokey,65,643,white,medium,Velit ut dolore ipsum amet aliquam quaerat aliquam.
644,Molly,65,644,white,long,Neque aliquam amet quisquam eius modi adipisci etincidunt.
645,Houdini,65,645,orange,short,Eius magnam labore ut quaerat numquam ipsum.
646,Ozzie,65,646,black,medium,Magnam labore sed eius.
647,Sam,65,647,spotted,medium,Adipisci numquam ipsum modi dolorem.
648,KC,65,648,spotted,long,Eius dolorem sit etincidunt etincidunt dolorem.
649,Silver,65,649,orange,short,Aliquam consectetur quisquam ipsum quaerat numquam amet quisquam.
650,Brie,65,650,spotted,short,Non porro etincidunt tempora porro adipisci amet.
651,Nutmeg,66,651,brown,long,Adipisci ipsum eius eius quisquam dolorem quaerat.
652,Keesha,66,652,orange,long,Velit sit quisquam modi velit sit dolorem etincidunt.
653,Grizzly,66,653,spotted,short,Consectetur est etincidunt dolorem adipisci etincidunt voluptatem neque.
654,Sterling,66,654,orange,medium,Labore voluptatem ipsum tempora aliquam tempora.
655,Ashley,66,655,orange,long,Est labore velit etincidunt velit dolor sit.
656,Oliver,66,656,brown,medium,Dolore dolore tempora velit neque.
657,Rico,66,657,spotted,medium,Labore eius adipisci ipsum.
658,Piggy,66,658,spotted,medium,Ipsum dolor quiquia ut quisquam quisquam consectetur amet.
659,Dunn,66,659,brown,medium,Ipsum est quaerat dolorem ut.
660,Wags,66,660,spotted,short,Amet dolorem neque ut magnam quiquia.
661,Ashes,67,661,black,long,Eius sit eius sit aliquam dolor velit non.
662,Smoke,67,662,orange,medium,Amet aliquam velit non eius.
663,Miasy,67,663,orange,long,Consectetur modi sed ut quaerat neque porro.
664,Topaz,67,664,brown,medium,Dolor dolor ut etincidunt neque dolorem etincidunt.
665,Buzzy,67,665,brown,long,Dolorem quiquia neque modi amet quiquia adipisci.
666,Clifford,67,666,spotted,long,Eius quaerat quisquam magnam.
667,Darby,67,667,white,medium,Non dolore dolor dolor.
668,Bessie,67,668,orange,long,Quaerat labore sed ut voluptatem est.
669,Bits,67,669,black,short,Est numquam est velit sit quisquam.
670,Vinnie,67,670,orange,medium,Sit aliquam amet dolor aliquam consectetur non quisquam.
671,Koty,68,671,orange,short,Est sit dolorem dolor dolore sed.
672,Roxie,68,672,spotted,medium,Consectetur dolorem tempora modi.
673,Layla,68,673,white,short,Labore sed eius dolorem labore dolorem.
674,Mulligan,68,674,brown,medium,Quaerat ut quisquam ipsum quaerat dolor.
675,Crackers,68,675,orange,short,Amet numquam dolore labore.
676,Dutchess,68,676,orange,short,Velit non quisquam modi consectetur voluptatem aliquam velit.
677,Solomon,68,677,black,long,Sed eius quaerat amet dolor.
678,Pretty-girl,68,678,black,short,Dolor dolore est neque neque quaerat dolore porro.
679,Major,68,679,spotted,medium,Tempora aliquam magnam dolorem labore numquam.
680,Mitzi,68,680,black,long,Numquam velit quisquam voluptatem etincidunt sit.
681,Patricky,69,681,black,medium,Etincidunt aliquam voluptatem sed quaerat.
682,Dandy,69,682,white,long,Dolore non est porro eius quisquam.
683,Bob,69,683,orange,short,Ut dolore numquam etincidunt modi ipsum porro etincidunt.
684,Gromit,69,684,black,long,Quaerat est quiquia dolor modi.
685,Mickey,69,685,spotted,long,Sit labore quisquam dolor adipisci ut ipsum.
686,Dreamer,69,686,brown,medium,Consectetur dolor modi sit consectetur.
687,Vava,69,687,brown,short,Modi neque quiquia eius porro quiquia sit voluptatem.
688,Cassie,69,688,white,medium,Adipisci consectetur quisquam aliquam velit eius quiquia.
689,Casper,69,689,brown,short,Dolor modi voluptatem ipsum sed quisquam etincidunt ipsum.
690,Chips,69,690,black,short,Dolor numquam velit dolore amet neque sit.
691,Crackers,70,691,brown,short,Consectetur numquam quaerat magnam.
692,Kirby,70,692,orange,medium,Dolorem est quiquia sit voluptatem ut.
693,Mona,70,693,black,long,Quisquam etincidunt eius labore.
694,Tinker,70,694,white,medium,Ut aliquam eius numquam dolore.
695,Hercules,70,695,white,long,Adipisci neque dolore etincidunt consectetur labore.
696,Trapper,70,696,black,long,Neque aliquam tempora dolor ipsum sed magnam magnam.
697,Milo,70,697,spotted,long,Neque eius amet eius aliquam.
698,Wilber,70,698,white,short,Velit labore numquam dolorem amet.
699,Barker,70,699,orange,medium,Quaerat consectetur quisquam voluptatem.
700,Taylor,70,700,brown,short,Tempora non quaerat est dolorem dolor voluptatem.
701,Lucifer,71,701,spotted,short,Non tempora numquam aliquam ipsum.
702,Wesley,71,702,spotted,short,Quiquia eius dolore voluptatem sit non.
703,Weaver,71,703,orange,short,Modi tempora consectetur magnam.
704,Daisy,71,704,white,short,Porro amet voluptatem est dolorem quaerat velit.
705,Simone,71,705,brown,long,Quiquia quaerat tempora eius velit quiquia sed non.
706,Noodles,71,706,orange,medium,Porro adipisci velit etincidunt amet amet amet.
707,Dewey,71,707,spotted,short,Ut dolore ipsum voluptatem non non quiquia labore.
708,Rolex,71,708,brown,short,Aliquam adipisci dolore dolor velit.
709,Puffy,71,709,spotted,long,Quaerat tempora dolore sit quisquam.
710,Kibbles,71,710,orange,short,Porro magnam est est velit ut modi.
711,Dutchess,72,711,brown,long,Ipsum eius consectetur aliquam.
712,Babbles,72,712,brown,long,Modi eius dolore dolorem dolor.
713,Sawyer,72,713,black,long,Labore est ut aliquam.
714,Skinny,72,714,spotted,medium,Tempora tempora sed est velit consectetur.
715,Speedy,72,715,orange,medium,Modi numquam voluptatem adipisci dolore dolore aliquam.
716,May,72,716,black,long,Quiquia quiquia voluptatem consectetur ipsum tempora labore.
717,Cupcake,72,717,orange,medium,Consectetur sed quisquam quiquia.
718,JJ,72,718,orange,short,Magnam sit ipsum amet quisquam etincidunt quiquia labore.
